{
  "slug": "repo-markets",
  "name": "eWpG Isolated Repo Markets & Vault",
  "version": "1.0.0",
  "description": "Technical isolated repo-market and curator-vault reference. Each configured collateral has separate cash, rate curve and liquidation LTV, while a vault routes deposits using operator caps. Borrowing checks the configured ecosystem permission and token transfer controls. Those mechanisms do not establish legal, custody, licensing, collateral, insolvency, oracle, liquidation, or KYC sufficiency. Lending and liquidation are not approved for production use pending jurisdiction-specific legal and risk decisions.",
  "category": "lending",
  "contracts": [
    {
      "name": "EwpgRepoMarket",
      "abiSha256": "810c2fdaee5403cbf4b53e5fc78aa244975ccb29b071f19b46252b511e8293b9",
      "sourceUrl": "https://github.com/registerwerk/registerwerk/blob/main/contracts/src/lending/EwpgRepoMarket.sol"
    },
    {
      "name": "EwpgRepoMarketFactory",
      "abiSha256": "f61d591003791db23d6cdfb7ea2d9a669cea38fddd8d5a0e4e9ba151a81e2946",
      "sourceUrl": "https://github.com/registerwerk/registerwerk/blob/main/contracts/src/lending/EwpgRepoMarketFactory.sol"
    },
    {
      "name": "EwpgRepoVault",
      "abiSha256": "efc14d6db57837f9563025290da6bd6b149dc341aa8005640d21d6bee11837e0",
      "sourceUrl": "https://github.com/registerwerk/registerwerk/blob/main/contracts/src/lending/EwpgRepoVault.sol"
    }
  ],
  "requiredPermissions": [
    {
      "code": "repo-markets.create-market",
      "rationale": "Operator-only: deploy a new isolated market for a security via the CREATE2 factory; the market is bound to the creating wallet's org"
    },
    {
      "code": "repo-markets.configure",
      "rationale": "Operating org only, on its own markets: set the reserve factor, pause new borrowing, and sweep reserves to the market's fixed treasury; on a vault it operates, revoke the curator's pending market addition or cap increase"
    },
    {
      "code": "repo-markets.reconcile",
      "rationale": "Operating org only, on its own markets: write a position's collateral down after a forced transfer, bounded on-chain by the collateral actually observed leaving the market"
    },
    {
      "code": "repo-markets.curate-vault",
      "rationale": "Vault's curator org only, on its own vault: propose adding a factory-deployed market or raising its cap (applied after the vault's timelock), remove markets, lower caps, and move idle cash into/out of a market"
    },
    {
      "code": "repo-markets.push-price",
      "rationale": "Operator or delegated NAV administrator: push a fresh collateral price mark shared across every market referencing it, within the oracle's per-window deviation cap; a delegated org may only push the assets the operator assigned to it with setAssetPusher"
    },
    {
      "code": "repo-markets.override-price",
      "rationale": "Oracle's operating org only: assign an asset's pusher org (setAssetPusher), push a mark past the deviation cap for a legitimate large NAV correction, and lower (never raise) the deviation cap"
    }
  ],
  "requiredClaimTopics": [
    1
  ],
  "paymentMethods": [
    {
      "rail": "aueur",
      "note": "Lender supply/withdrawal and borrower draws/repayments denominated in AllUnity Euro"
    },
    {
      "rail": "usdc",
      "note": "Alternative USD-denominated liquidity for lenders and borrowers"
    }
  ],
  "images": [
    {
      "name": "backend",
      "role": "backend",
      "ref": "ghcr.io/registerwerk/examples/repo-markets-backend@sha256:e8aa5dd8731d20b0ae577bd0d4b43160e2378739409e3e4293327abe8ef3cc63"
    },
    {
      "name": "frontend",
      "role": "frontend",
      "ref": "ghcr.io/registerwerk/examples/repo-markets-frontend@sha256:a9fc90ee42fc5beeb3716d03249002caa0700427e23941c5e1b7c11cc1dc0e6f"
    }
  ],
  "deployment": {
    "composeUrl": "https://github.com/registerwerk/registerwerk/blob/main/examples/dapps/repo-markets/docker-compose.yml",
    "composeSha256": "9df5de1b16b57d9484982b4ce0d2fba9ee13e35294f241446fb2ab893ec738d5"
  },
  "docsUrl": "https://docs.registerwerk.de/platform/defi-interoperability",
  "contact": "dapps@registerwerk.de",
  "license": "MIT",
  "pricingNote": "Reference implementation — free, self-hosted"
}
